{
  "schema_version": "0.1.0",
  "generated_at": "2026-04-28T00:00:00Z",
  "query": "AI inference chips",
  "items": [
    {
      "id": "news_fixture_001",
      "title": "Nvidia and Broadcom benefit as hyperscaler AI inference capex rises",
      "summary": "Hyperscaler capex, HBM capacity, advanced packaging and power cooling demand are key variables.",
      "entities": ["Nvidia", "Broadcom"],
      "trigger_type": "Demand",
      "confidence": "medium",
      "source_id": "news_fixture_001"
    },
    {
      "id": "news_fixture_002",
      "title": "AI inference demand boosts HBM and advanced packaging bottlenecks",
      "summary": "Memory suppliers and foundry packaging capacity remain scarce.",
      "entities": ["TSMC", "SK Hynix"],
      "trigger_type": "Supply",
      "confidence": "medium",
      "source_id": "news_fixture_002"
    }
  ],
  "sources": [],
  "errors": []
}
